"ID","Name","Alternate Names"
"112126428","Distracted Boyfriend","distracted bf, guy checking out another girl, man looking at other woman, jealous girlfriend, guy looking back, cheater temptation, wandering eyes, disloyal boyfriend"
"438680","Batman Slapping Robin",""
"87743020","Two Buttons","2 red buttons, choice button, which button, daily struggle, hard choice to make"
"181913649","Drake Hotline Bling","drakeposting, drakepost, drake hotline approves, drake no yes, drake like dislike, drake faces"
"61579","One Does Not Simply","one does not simply walk into morder, lord of the rings boromir"
"102156234","Mocking Spongebob","spongebob mock, spongebob chicken, retarded spongebob, sarcastic spongebob, spongebob stupid, spongebob derp, spongebob bird, spongebob mocking face"
"101470","Ancient Aliens","Giorgio Tsoukalos, History Channel Guy"
"93895088","Expanding Brain",""
"124822590","Left Exit 12 Off Ramp","car drifts off highway, sharp turn on road"
"129242436","Change My Mind","Steven Crowder's sign, prove me wrong"
"61520","Futurama Fry","Not sure if X or Y, Skeptical Fry"
"89370399","Roll Safe Think About It","thinking black guy, black guy pointing at his head, can't blank if you don't blank, smart black dude, guy tapping head"
"4087833","Waiting Skeleton","skeleton waiting on bench in the park"
"1035805","Boardroom Meeting Suggestion","throw a guy out the boardroom window"
"91538330","X, X Everywhere","woody and buzz lightyear pointing, toy story, dicks everywhere, toystory everywhere"
"188390779","Woman Yelling At Cat","Women yelling, confused cat, girl screaming at cat, angry woman yelling at cat at dinner table, lady screams at cat, woman pointing at cat, smudge the cat"
"61532","The Most Interesting Man In The World","I dont always... but when I do, Dos Equis Man, I don't always"
"61585","Bad Luck Brian",""
"119139145","Blank Nut Button","blank blue button, smash button, press button, button slam"
"5496396","Leonardo Dicaprio Cheers","The Great Gatsby party with Jay Gatsby"
"61539","First World Problems","fwp, woman crying"
"8072285","Doge","Shiba Inu"
"155067746","Surprised Pikachu","shocked pikachu"
"97984","Disaster Girl",""
"124055727","Y'all Got Any More Of That","Tyrone Biggums, Dave Chappelle, Chappelles Show, yall got any more of that stuff, powder lips neck scratch"
"61527","Y U No",""
"21735","The Rock Driving",""
"28251713","Oprah You Get A","oprah giveway, oprah winfrey, oprah you get a car, everyone gets a car, you get an oprah, oprah excited"
"61546","Brace Yourselves X is Coming","imminent ned from game of thrones, brace yourselves winter is coming, brace yourself"
"61582","Creepy Condescending Wonka","willy wonka stare, sarcastic wonka, tell me more about X, tell me again, gene wilder"
"563423","That Would Be Great","Bill Lumbergh, office space, yea that'd be great"
"61533","X All The Y","all the things"
"114585149","Inhaling Seagull","inhaling bird"
"101288","Third World Skeptical Kid","African skeptical child"
"100777631","Is This A Pigeon","is this a pidgeon, anime butterfly guy, oblivious butterfly man anime, is this a bird"
"131087935","Running Away Balloon","big yellow ball and pink guy, me vs my hopes and dreams"
"405658","Grumpy Cat",""
"1509839","Captain Picard Facepalm","star trek face palm"
"16464531","But That's None Of My Business","Kermit the frog, kermit drinking lipton iced tea"
"123999232","The Scroll Of Truth","I've finally found it... after 15 years, nyehhh"
"27813981","Hide the Pain Harold","sad life harold, maurice"
"6235864","Finding Neverland","Johnny Depp And Little Kid Crying"
"14230520","Black Girl Wat","confused black girl, black girl with hand out, seriously black girl"
"100947","Matrix Morpheus","what if I told you"
"101511","Don't You Squidward","spongebob grinning, spongebob smirk face, smug spongebob"
"134797956","American Chopper Argument","orange county choppers fight, american chopper hot take"
"61556","Grandma Finds The Internet",""
"91545132","Trump Bill Signing","executive order trump"
"235589","Evil Toddler","evil baby"
"14371066","Star Wars Yoda","master yoda"
"245898","Picard Wtf","captain jean-luc picard star trek, annoyed picard, why the fuck would you"
"61544","Success Kid","Motivation Baby, Motivation Kid, Success Baby"
"61516","Philosoraptor","green dinosaur, dinosaur wondering"
"101287","Third World Success Kid","happy african child, african kids dancing"
"101440","10 Guy","Really High Guy, Stoner Stanley, Brainwashed Bob, stoned guy, ten guy"
"178591752","Tuxedo Winnie The Pooh","winnie the poo, winnie the pooh drake style, classy pooh bear, tuxedo pooh, winnie the pooh elegant, winnie pooh, winnie the pooh tux, fancy pooh"
"84341851","Evil Kermit","kermit me to me, kermit inner me, sith kermit, kermit dark side"
"161865971","Marked Safe From","facebook marked safe, marked safe flag, marked safe today, facebook safe from"
"40945639","Dr Evil Laser","Dr. Evil quotation marks, Dr Evil Air Quotes"
"922147","Laughing Men In Suits","Men laughing, And then I said, And then I told them, rich men laughing"
"259680","Am I The Only One Around Here","Angry Walter from The Big Lebowski"
"9440985","Face You Make Robert Downey Jr",""
"61580","Too Damn High","The rent is too damn high"
"101910402","Who Would Win?",""
"101716","Yo Dawg Heard You","Xzibit, Yo dawg we heard you like Y so we put some X in your X so you can Y while you Y"
"175540452","Unsettled Tom","tom face, concerned tom, tom and jerry, disgusted tom, surprised tom, tom staring down"
"61581","Put It Somewhere Else Patrick","patrick from spongebob"
"109765","I'll Just Wait Here","waiting skeleton"
"196652226","Spongebob Ight Imma Head Out","Ight Imma Head Out, aight imma head out, spongebob aight, alright I'm out, spongebob getting out of chair"
"56225174","Be Like Bill","bill the stick figure with a hat"
"217743513","UNO Draw 25 Cards","do something you don’t like or draw 25 cards, uno dilemma, uno or draw 25, draw 25"
"135256802","Epic Handshake","arm wrestling, holding hands, grasping hands, epic hand shake, black white arms agreement"
"12403754","Bad Pun Dog","joke dog, whisper joke dog, happy husky, joke telling husky, pun husky"
"132769734","Hard To Swallow Pills","hard pills to swallow"
"195389","Sparta Leonidas","Leonidas from the movie 300"
"135678846","Who Killed Hannibal","Eric Andre shooting Hannibal Buress, why would they do this"
"100955","Confession Bear",""
"766986","Aaaaand Its Gone","and it's gone, south park banker guy"
"718432","Back In My Day","grumpy old man pointing"
"21604248","Mugatu So Hot Right Now","Mugatu from Zoolander, Will Farrell"
"444501","Maury Lie Detector","The lie detector determined that was a lie. The fact that you X determined that was a lie. Maury Povich."
"222403160","Bernie I Am Once Again Asking For Your Support","bernie sanders commercial, bernie sanders 2020 campaign, asking for your financial support, once again bernie"
"61583","Conspiracy Keanu",""
"124212","Say That Again I Dare You","Samuel L Jackson, pulp fiction"
"13757816","Awkward Moment Sealion","awkward seal, uncomfortable situation sealion, heavy breathing sealion"
"143601","Steve Harvey",""
"3218037","This Is Where I'd Put My Trophy If I Had One",""
"163573","Imagination Spongebob","spongebob rainbow, nobody cares"
"442575","Ain't Nobody Got Time For That",""
"1790995","And everybody loses their minds","Heath Ledger Joker from The Dark Knight"
"460541","Jack Sparrow Being Chased","pirates of the caribbean"
"101711","Skeptical Baby",""
"6531067","See Nobody Cares","Jurassic Park Dennis"
"80707627","Sad Pablo Escobar","pablo escobar waiting, man waiting, waiting man, lonely man, narcos waiting, narcos bored, narcos alone"
"10628640","Archer","Do you want X? Because that's how you get X. Do you want ants? Because that's how you get ants."
"29617627","Look At Me","I'm the captain now, captain phillips"
"1367068","I Should Buy A Boat Cat","sophisticated cat, fancy cat, newspaper cat"
"89655","Uncle Sam","USA, murica"
"184801100","Me And The Boys","Old Spider-Man Villains, 60's spiderman villains, Rhino Vulture Electro and Green Goblin, me and the bois"
"61522","Scumbag Steve",""
